{
  "$schema": "https://json-schema.org/draft/2020-12/schema",
  "$id": "https://carelens.invalid/contracts/carelens/capture-session.v2.schema.json",
  "title": "capture-session.v2",
  "x-generated-from": "backend/care-monitoring/worker/src/contracts.ts (do not edit by hand)",
  "type": "object",
  "properties": {
    "schema_version": {
      "type": "string",
      "const": "capture-session.v2"
    },
    "source_mode": {
      "type": "string",
      "enum": [
        "device",
        "simulated"
      ]
    },
    "device_id": {
      "type": "string",
      "minLength": 1,
      "maxLength": 64,
      "pattern": "^[A-Za-z0-9._:-]+$"
    },
    "capture_id": {
      "type": "string",
      "minLength": 1,
      "maxLength": 128,
      "pattern": "^[A-Za-z0-9._:-]+$",
      "description": "Burst (segment) identifier, unique per device. A burst never spans a camera-off interval."
    },
    "mode": {
      "type": "string",
      "enum": [
        "normal",
        "triggered"
      ]
    },
    "clock": {
      "type": "object",
      "properties": {
        "boot_id": {
          "type": "string",
          "minLength": 8,
          "maxLength": 64,
          "pattern": "^[A-Za-z0-9._:-]+$",
          "description": "Random identifier the firmware generates at every boot. All uptime_ms values are relative to this boot."
        },
        "uptime_ms": {
          "type": "integer",
          "minimum": 0,
          "maximum": 1000000000000,
          "description": "Device monotonic clock when this request body was built."
        },
        "wall_clock_synced": {
          "type": "boolean",
          "description": "true only after SNTP synchronisation succeeded in this boot."
        },
        "wall_time": {
          "anyOf": [
            {
              "type": "string",
              "maxLength": 40,
              "pattern": "^\\d{4}-\\d{2}-\\d{2}T\\d{2}:\\d{2}:\\d{2}(\\.\\d{1,9})?(Z|[+-]\\d{2}:\\d{2})$"
            },
            {
              "type": "null"
            }
          ],
          "description": "Device wall clock at uptime_ms when synced; diagnostics only, never used to order evidence."
        }
      },
      "required": [
        "boot_id",
        "uptime_ms",
        "wall_clock_synced",
        "wall_time"
      ],
      "additionalProperties": false,
      "description": "Clock block of every device request. The backend maps uptime to server time per boot (received_at − uptime_ms, minimum over the boot); evidence from the same boot is aligned on uptime_ms directly."
    },
    "frame_count": {
      "anyOf": [
        {
          "type": "number",
          "const": 24
        },
        {
          "type": "number",
          "const": 40
        }
      ]
    },
    "nominal_fps": {
      "type": "number",
      "const": 8
    },
    "content_type": {
      "type": "string",
      "const": "image/jpeg"
    },
    "frame_width": {
      "type": "integer",
      "minimum": 16,
      "maximum": 640
    },
    "frame_height": {
      "type": "integer",
      "minimum": 16,
      "maximum": 480
    },
    "frames": {
      "minItems": 24,
      "maxItems": 40,
      "type": "array",
      "items": {
        "type": "object",
        "properties": {
          "seq": {
            "type": "integer",
            "minimum": 0,
            "maximum": 39
          },
          "uptime_ms": {
            "type": "integer",
            "minimum": 0,
            "maximum": 1000000000000,
            "description": "Device monotonic time the frame was captured."
          },
          "size_bytes": {
            "type": "integer",
            "minimum": 4,
            "maximum": 200000
          },
          "sha256": {
            "type": "string",
            "pattern": "^[0-9a-f]{64}$"
          }
        },
        "required": [
          "seq",
          "uptime_ms",
          "size_bytes",
          "sha256"
        ],
        "additionalProperties": false
      }
    },
    "trigger_id": {
      "anyOf": [
        {
          "type": "string",
          "minLength": 1,
          "maxLength": 128,
          "pattern": "^[A-Za-z0-9._:-]+$"
        },
        {
          "type": "null"
        }
      ]
    },
    "trigger_frame_index": {
      "anyOf": [
        {
          "type": "integer",
          "minimum": 0,
          "maximum": 39
        },
        {
          "type": "null"
        }
      ]
    },
    "firmware_version": {
      "anyOf": [
        {
          "type": "string",
          "minLength": 1,
          "maxLength": 64
        },
        {
          "type": "null"
        }
      ]
    }
  },
  "required": [
    "schema_version",
    "source_mode",
    "device_id",
    "capture_id",
    "mode",
    "clock",
    "frame_count",
    "nominal_fps",
    "content_type",
    "frame_width",
    "frame_height",
    "frames",
    "trigger_id",
    "trigger_frame_index",
    "firmware_version"
  ],
  "additionalProperties": false,
  "description": "One camera burst announced before its JPEG chunks are uploaded. Adapter proposal; not yet verified against ESP32 firmware."
}
